{
  "schema_version": "1.0.0",
  "repository": "Pick-Your-AI/pick-your-ai-datasets",
  "status": "published",
  "issues": {
    "DATA": 1,
    "DATA-01": 2,
    "DATA-01.01": 3,
    "DATA-01.02": 4,
    "DATA-01.03": 5,
    "DATA-01.04": 6,
    "DATA-01.05": 7,
    "DATA-02": 8,
    "DATA-02.01": 9,
    "DATA-02.02": 10,
    "DATA-02.03": 11,
    "DATA-02.04": 12,
    "DATA-02.05": 13,
    "DATA-02.06": 14,
    "DATA-03": 15,
    "DATA-03.01": 16,
    "DATA-03.02": 17,
    "DATA-03.03": 18,
    "DATA-03.04": 19,
    "DATA-03.05": 20,
    "DATA-03.06": 21,
    "DATA-04": 22,
    "DATA-04.01": 23,
    "DATA-04.02": 24,
    "DATA-04.03": 25,
    "DATA-04.04": 26,
    "DATA-05": 27,
    "DATA-05.01": 28,
    "DATA-05.02": 29,
    "DATA-05.03": 30,
    "DATA-05.04": 31,
    "DATA-05.05": 32,
    "DATA-06": 33,
    "DATA-06.01": 34,
    "DATA-06.02": 35,
    "DATA-06.03": 36,
    "DATA-06.04": 37,
    "DATA-06.05": 38,
    "DATA-07": 39,
    "DATA-07.01": 40,
    "DATA-07.02": 41,
    "DATA-07.03": 42,
    "DATA-07.04": 43,
    "DATA-07.05": 44,
    "DATA-07.06": 45,
    "DATA-08": 46,
    "DATA-08.01": 47,
    "DATA-08.02": 48,
    "DATA-08.03": 49,
    "DATA-08.04": 50,
    "DATA-09": 51,
    "DATA-09.01": 52,
    "DATA-09.02": 53,
    "DATA-09.03": 54,
    "DATA-09.04": 55,
    "DATA-10": 56,
    "DATA-10.01": 57,
    "DATA-10.02": 58,
    "DATA-10.03": 59,
    "DATA-10.04": 60,
    "DATA-10.05": 61,
    "DATA-11": 62,
    "DATA-11.01": 63,
    "DATA-11.02": 64,
    "DATA-11.03": 65,
    "DATA-11.04": 66,
    "DATA-12": 67,
    "DATA-12.01": 68,
    "DATA-12.02": 69,
    "DATA-12.03": 70,
    "DATA-12.04": 71,
    "DATA-12.05": 72,
    "DATA-12.06": 73
  }
}
